{
  "abstention": {
    "correct": false,
    "expected": false,
    "observed": true
  },
  "failure_attribution": {
    "categories": [
      "retrieval_failure"
    ],
    "primary": "retrieval_failure"
  },
  "generation": {
    "configuration": {
      "max_output_tokens": 1000,
      "max_retries": 0,
      "model": "qwen3:4b-instruct-2507-q4_K_M",
      "prompt": {
        "max_context_characters": 60000,
        "version": "sec_grounded_v1"
      },
      "provider": "ollama",
      "provider_options": {
        "model_digest": "0edcdef34593eac1aa2be9c7d06c432dcf81945adca5eca2f27662c18f168ba0",
        "num_ctx": 16384,
        "seed": 0
      },
      "temperature": 0,
      "timeout_seconds": 600
    },
    "latency_seconds": 13.531791332992725,
    "status": "success",
    "token_usage": {
      "input_tokens": 4241,
      "output_tokens": 23,
      "total_tokens": 4264
    }
  },
  "latency": {
    "end_to_end_seconds": null,
    "orchestration_seconds": null,
    "recorded_scope": "historical_generation_pipeline",
    "recorded_seconds": 13.534387583000353,
    "tool_seconds": null
  },
  "lower_level": {
    "attempts": [
      {
        "attempt": 1,
        "error": null,
        "latency_seconds": 13.531791332992725,
        "token_usage": {
          "input_tokens": 4241,
          "output_tokens": 23,
          "total_tokens": 4264
        }
      }
    ],
    "error": null,
    "generation_status": "success",
    "legacy_attribution": "retrieval_failure",
    "legacy_evaluation": {
      "attribution": "retrieval_failure",
      "citation_precision": null,
      "citation_recall": null,
      "citation_validity": true,
      "correctness": null,
      "groundedness_heuristic": null,
      "retrieval_evidence_present": false
    },
    "orchestration_status": null
  },
  "query": {
    "id": "SEC-052",
    "policy": "unreviewed_text_withheld",
    "text": "[REDACTED]"
  },
  "result": {
    "answer": "[REDACTED]",
    "citations": [],
    "claims_supported": null,
    "evidence_sufficient": false,
    "orchestration_status": "retrieval_failure",
    "validation_status": "passed"
  },
  "retrieval": {
    "configuration": {
      "mode": "bm25",
      "top_k": 5
    },
    "evidence": [
      {
        "accession_number": "0000950170-25-100235",
        "chunk_id": "e18b4b49238795b3b5d3e80caa044c341752bd39af463f9816c9d39436491232",
        "cik": "0000789019",
        "context_id": "C001",
        "document_id": "MSFT_000095017025100235",
        "end_char": 149527,
        "filing_date": "2025-07-30",
        "form": "10-K",
        "item": "7",
        "report_date": "2025-06-30",
        "section_id": "MSFT_000095017025100235:item_7",
        "source_document_id": "MSFT_000095017025100235",
        "source_url": "https://www.sec.gov/Archives/edgar/data/789019/000095017025100235/msft-20250630.htm",
        "start_char": 147659,
        "ticker": "MSFT"
      },
      {
        "accession_number": "0000320193-25-000079",
        "chunk_id": "e81ac7409bd0d9e7cb9fe232b8db21921b826602c0470be8328e19eb8f9df053",
        "cik": "0000320193",
        "context_id": "C002",
        "document_id": "AAPL_000032019325000079",
        "end_char": 140025,
        "filing_date": "2025-10-31",
        "form": "10-K",
        "item": "8",
        "report_date": "2025-09-27",
        "section_id": "AAPL_000032019325000079:item_8",
        "source_document_id": "AAPL_000032019325000079",
        "source_url": "https://www.sec.gov/Archives/edgar/data/320193/000032019325000079/aapl-20250927.htm",
        "start_char": 138078,
        "ticker": "AAPL"
      },
      {
        "accession_number": "0001045810-25-000023",
        "chunk_id": "76a4a545fbe2c2eb87841d6aeeab382bd5b8373991956bb5fd5b7d0f72316d5f",
        "cik": "0001045810",
        "context_id": "C003",
        "document_id": "NVDA_000104581025000023",
        "end_char": 214710,
        "filing_date": "2025-02-26",
        "form": "10-K",
        "item": "7",
        "report_date": "2025-01-26",
        "section_id": "NVDA_000104581025000023:item_7",
        "source_document_id": "NVDA_000104581025000023",
        "source_url": "https://www.sec.gov/Archives/edgar/data/1045810/000104581025000023/nvda-20250126.htm",
        "start_char": 212816,
        "ticker": "NVDA"
      },
      {
        "accession_number": "0000950170-25-100235",
        "chunk_id": "5d50cc60bd456fb10484b501e17b566a23155f21b66fe10431b7e787df47fa6e",
        "cik": "0000789019",
        "context_id": "C004",
        "document_id": "MSFT_000095017025100235",
        "end_char": 204164,
        "filing_date": "2025-07-30",
        "form": "10-K",
        "item": "8",
        "report_date": "2025-06-30",
        "section_id": "MSFT_000095017025100235:item_8",
        "source_document_id": "MSFT_000095017025100235",
        "source_url": "https://www.sec.gov/Archives/edgar/data/789019/000095017025100235/msft-20250630.htm",
        "start_char": 202589,
        "ticker": "MSFT"
      },
      {
        "accession_number": "0000950170-24-087843",
        "chunk_id": "0b152e3b4760fa13dfc1cec3e4786615795d8da48fc16a52c7aed9a4495b3e0b",
        "cik": "0000789019",
        "context_id": "C005",
        "document_id": "MSFT_000095017024087843",
        "end_char": 9982,
        "filing_date": "2024-07-30",
        "form": "10-K",
        "item": "1",
        "report_date": "2024-06-30",
        "section_id": "MSFT_000095017024087843:item_1",
        "source_document_id": "MSFT_000095017024087843",
        "source_url": "https://www.sec.gov/Archives/edgar/data/789019/000095017024087843/msft-20240630.htm",
        "start_char": 8120,
        "ticker": "MSFT"
      }
    ],
    "evidence_sufficient": false,
    "latency_seconds": 0.0020952080085407943,
    "latency_source": "recorded_retrieval_stage",
    "matched_evidence_ids": [],
    "required_evidence_ids": [
      "E1",
      "E2"
    ],
    "sufficiency_basis": "benchmark_required_evidence_coverage"
  },
  "routing": {
    "correct": null,
    "decision": null,
    "latency_seconds": null,
    "reason": null,
    "tools_selected": null
  },
  "schema_version": "6.1",
  "source": {
    "id": "evals/generation/phase4a_ollama/traces/66ddbfa42bede9189823e4d58263ce00bcaf92ba4dc71cd42f71433848ce7114.json",
    "kind": "phase4b",
    "sha256": "42bffed5a977568e35bc68becb494272d5a190ce770c20c06e005d0e3a4714d7"
  },
  "timestamp": null,
  "tools": [],
  "trace_id": "1cde7f09a1533d09a3b12bbdb80a0eaf6c438b1eb951c177898461dbefba9170",
  "validation": {
    "citation_valid": true,
    "details": [],
    "errors": [],
    "json_schema_valid": true,
    "latency_seconds": null,
    "output_contract_valid": true
  }
}
